### ISSUE TITLE
cf ssh works with diego mTLS enabled even though docs say it shouldn't

### ISSUE THREAD

**Issue by domdom82** [cloudfoundry/docs-dev-guide#413]
Hi, 
this issue takes the discussion about cf ssh and mTLS from https://github.com/cloudfoundry/nats-release/issues/25#issuecomment-709073717 to docs instead.

Let me explain:

- We recently suffered a major NATS outage that caused all routes to be pruned as a ripple effect.
- We are currently evaluating route integrity as a solution to survive NATS hiccups without losing all routes.
- CF SSH is a nice feature and our customers like it.
- https://docs.cloudfoundry.org/devguide/deploy-apps/app-ssh-overview.html and nested docs claim it does no longer work with route integrity (i.e. mTLS between gorouter and diego apps) enabled.
- I've tried it with the latest cf-deployment `v13.20.0`
- It worked.

## Here is my analysis:

I *think* I have configured everything so that actual mTLS is happening, yet still I am able to do a cf ssh into my app.

This is what my app looks like on cfdot:
```
{
  "process_guid": "f339d890-47dc-48fb-892f-b1781ac8e963-9cd719b4-8eae-4ea2-9ee1-db2594216456",
  "index": 0,
  "domain": "cf-apps",
  "instance_guid": "4c3104bb-f789-4501-478c-dd94",
  "cell_id": "3f7599e5-c105-449a-9665-e745bc299bb2",
  "address": "10.0.73.1",
  "ports": [
    {
      "container_port": 8080,
      "host_port": 61012,
      "container_tls_proxy_port": 61001,
      "host_tls_proxy_port": 61014
    },
    {
      "container_port": 2222,
      "host_port": 61013,
      "container_tls_proxy_port": 61002,
      "host_tls_proxy_port": 61015
    }
  ],
  "instance_address": "10.141.12.193",
  "preferred_address": "HOST",
  "crash_count": 0,
  "state": "RUNNING",
  "since": 1602738314291106300,
  "modification_tag": {
    "epoch": "05461369-1851-4fba-490c-e9f3461ec149",
    "index": 2
  },
  "presence": "ORDINARY"
}
```

So far so good. Here is my diego-cell config of cf-deployment:

```
name: diego-cell
jobs:
(...)
- name: rep
  properties:
    (...)
    containers:
      proxy:
        enabled: true
        require_and_verify_client_certificates: true
        trusted_ca_certificates:
        - ((gorouter_backend_tls.ca))
        - ((ssh_proxy_backends_tls.ca))
        verify_subject_alt_name:
        - gorouter.service.cf.internal
        - ssh-proxy.service.cf.internal
      trusted_ca_certificates:
      - ((diego_instance_identity_ca.ca))
      - ((credhub_tls.ca))
      - ((uaa_ssl.ca))
(...)
  release: diego
(...)
```

So to me this looks like mTLS should be enabled, right? (`require_and_verify_client_certificates: true`)

I also took a tcpdump when I connected the ssh session:
```
No.     Time           Time Delta     Source                Destination           Protocol Length Calculated window size Info
     39 6.299363       4.100878       10.0.65.71            10.158.16.8           TCP      74     62727                  47948 → 61002 [SYN] Seq=2857877295 Win=62727 Len=0 MSS=8961 SACK_PERM=1 TSval=1867992293 TSecr=0 WS=128

No.     Time           Time Delta     Source                Destination           Protocol Length Calculated window size Info
     40 6.299389       0.000026       10.158.16.8           10.0.65.71            TCP      74     62293                  61002 → 47948 [SYN, ACK] Seq=4288799740 Ack=2857877296 Win=62293 Len=0 MSS=8911 SACK_PERM=1 TSval=577200733 TSecr=1867992293 WS=128

No.     Time           Time Delta     Source                Destination           Protocol Length Calculated window size Info
     41 6.299504       0.000115       10.0.65.71            10.158.16.8           TCP      66     62848                  47948 → 61002 [ACK] Seq=2857877296 Ack=4288799741 Win=62848 Len=0 TSval=1867992293 TSecr=577200733

No.     Time           Time Delta     Source                Destination           Protocol Length Calculated window size Info
     42 6.299598       0.000094       10.0.65.71            10.158.16.8           TLSv1.2  264    62848                  Client Hello

No.     Time           Time Delta     Source                Destination           Protocol Length Calculated window size Info
     43 6.299606       0.000008       10.158.16.8           10.0.65.71            TCP      66     62208                  61002 → 47948 [ACK] Seq=4288799741 Ack=2857877494 Win=62208 Len=0 TSval=577200733 TSecr=1867992294

No.     Time           Time Delta     Source                Destination           Protocol Length Calculated window size Info
     44 6.302096       0.002490       10.158.16.8           10.0.65.71            TLSv1.2  2378   62208                  Server Hello, Certificate, Server Key Exchange, Certificate Request, Server Hello Done

No.     Time           Time Delta     Source                Destination           Protocol Length Calculated window size Info
     45 6.302281       0.000185       10.0.65.71            10.158.16.8           TCP      66     60544                  47948 → 61002 [ACK] Seq=2857877494 Ack=4288802053 Win=60544 Len=0 TSval=1867992296 TSecr=577200735

No.     Time           Time Delta     Source                Destination           Protocol Length Calculated window size Info
     46 6.306147       0.003866       10.0.65.71            10.158.16.8           TLSv1.2  1312   60544                  Certificate, Client Key Exchange, Certificate Verify, Change Cipher Spec, Encrypted Handshake Message

No.     Time           Time Delta     Source                Destination           Protocol Length Calculated window size Info
     47 6.307105       0.000958       10.158.16.8           10.0.65.71            TLSv1.2  117    61056                  Change Cipher Spec, Encrypted Handshake Message

No.     Time           Time Delta     Source                Destination           Protocol Length Calculated window size Info
     48 6.307214       0.000109       10.158.16.8           10.0.65.71            TLSv1.2  115    61056                  Application Data

```

So the ssh-proxy does connect to the envoy listener on port 61002 and there is a mTLS handshake happening (both parties present a certificate, see packet nr 46). After that there is regular application data going over the wire. (I could log in, got a shell, did some echo  hello etc.)

Here is a `ps` output of my SSH session:
```
vcap@4c3104bb-f789-4501-478c-dd94:~$ ps -xaf
    PID TTY      STAT   TIME COMMAND
    110 ?        Ssl    0:00 /etc/cf-assets/healthcheck/healthcheck -port=8080 -timeout=1000ms -liveness-interval=30
     22 ?        Ss     0:00 sh -c trap 'kill -9 0' TERM; /etc/cf-assets/envoy/envoy -c /etc/cf-assets/envoy_config/
     62 ?        Sl     0:29  \_ /etc/cf-assets/envoy/envoy -c /etc/cf-assets/envoy_config/envoy.yaml --drain-time-s
     17 ?        Ssl    0:00 npm
    102 ?        S      0:00  \_ sh -c node app.js
    103 ?        Sl     0:00      \_ node app.js
     11 ?        Ssl    0:00 /tmp/lifecycle/diego-sshd --allowedKeyExchanges= --address=0.0.0.0:2222 --allowUnauthen
    132 pts/0    Ss     0:00  \_ /bin/bash
    142 pts/0    R+     0:00      \_ ps -xaf
      1 ?        Ss     0:00 /tmp/garden-init
```

So there is the envoy running, my node app and the diego-sshd that forked off my shell.

Here is a list of connections on the app container:
```
vcap@4c3104bb-f789-4501-478c-dd94:~$ netstat -ant
Active Internet connections (servers and established)
Proto Recv-Q Send-Q Local Address           Foreign Address         State
tcp        0      0 0.0.0.0:61001           0.0.0.0:*               LISTEN
tcp        0      0 0.0.0.0:61002           0.0.0.0:*               LISTEN
tcp        0      0 127.0.0.1:61003         0.0.0.0:*               LISTEN
tcp        0      0 0.0.0.0:2222            0.0.0.0:*               LISTEN
tcp        0      0 0.0.0.0:8080            0.0.0.0:*               LISTEN
tcp        0      0 10.141.12.193:40308     10.141.12.193:8080      TIME_WAIT
tcp      180      0 10.141.12.193:52974     10.141.12.193:2222      ESTABLISHED
tcp        0    180 10.141.12.193:2222      10.141.12.193:52974     ESTABLISHED
tcp        0      0 10.141.12.193:61002     10.0.65.71:55904        ESTABLISHED
tcp        0      0 10.141.12.193:40180     10.141.12.193:8080      TIME_WAIT
```

The connection between ssh-proxy and my container on port 61002 can be seen. Not sure about the local connection on port 2222. I guess this is ssh being forwarded by envoy to the sshd? But it all looks like it is working just fine.

## The docs state: 

> If you have mutual TLS between the Gorouter and app containers, app containers accept incoming communication only from the Gorouter

I think from what I have presented above this no longer holds true, as the app container also accepts incoming communication from the SSH-proxy.

Am I missing something here?

**Comment by mlimonczenko** [comment]
Hello @domdom82,

We were unable to prioritize this request at the time the issue was filed.

If this issue is still relevant, submit a new pull request (preferred) or a new GitHub issue.

I am closing this request. Thank you so much for your contribution.
